{
  "version": "1.0",
  "style_playbook": "vox-paper-collage",
  "timing_source": "tts_actual",
  "timing_calibration_status": "calibrated",
  "script_duration_seconds": 168.2,
  "target_duration_seconds": 180,
  "scenes": [
    {
      "id": "sc1",
      "type": "paper_collage",
      "description": "Viral Hook：1988 年创立 → 37 年后管理 10.5 万亿 → 贝莱德",
      "paragraph_label": "viral_hook",
      "locked_camera": true,
      "start_seconds": 0,
      "end_seconds": 15.8,
      "script_section_id": "s1",
      "shot_intent": "用强数字钩子建立好奇心：两个男人、一间公寓、10.5 万亿美元",
      "narrative_role": "deliver_payload",
      "beats": [
        {
          "id": "b1.1",
          "sync_sentence": "1988年，纽约一间小公寓里，两个男人创立了一家资产管理公司。",
          "semantic_family": "drop",
          "duration_seconds": 4.3,
          "start_seconds": 0,
          "end_seconds": 4.3,
          "visual_idea": "旧报纸标题 + 小公寓楼 hero cutout + 红色图钉",
          "elements": [
            {
              "layer": "bg",
              "kind": "img",
              "data_class": "creative",
              "description": "aged newspaper front page texture with 1988 date, halftone dots",
              "box": [
                0,
                0,
                100,
                100
              ],
              "rot": 0,
              "z": 0,
              "family": "fade",
              "micro": "breathe"
            },
            {
              "layer": "hero",
              "kind": "img",
              "data_class": "creative",
              "description": "small 1980s New York apartment building black-and-white cutout",
              "box": [
                22,
                18,
                45,
                50
              ],
              "rot": -2,
              "z": 10,
              "family": "drop",
              "micro": "breathe"
            },
            {
              "layer": "decor",
              "kind": "css",
              "data_class": "css",
              "description": "red push pin at top-left",
              "text": "",
              "family": "pop",
              "micro": "pulse"
            },
            {
              "layer": "element",
              "kind": "img",
              "data_class": "creative",
              "description": "1988 date stamp in red ink, vintage rubber stamp effect, slightly rotated",
              "box": [
                78,
                15,
                16,
                10
              ],
              "rot": -8,
              "z": 15,
              "family": "slap",
              "micro": "pulse"
            },
            {
              "layer": "element",
              "kind": "img",
              "data_class": "creative",
              "description": "two men silhouettes in 1980s suits standing together, black-and-white paper cutout",
              "box": [
                28,
                62,
                18,
                20
              ],
              "rot": 0,
              "z": 13,
              "family": "pop",
              "micro": "sway"
            }
          ],
          "core_idea": "微小起点：从一间公寓开始的帝国",
          "visual_metaphor": "小公寓楼剪影：一座即将长大的微小建筑",
          "image_prompt": "Warm beige paper background with grain and halftone texture, museum-quiet archival mood. LEFT FOREGROUND, LOW: a tiny 1980s New York brownstone apartment building, black-and-white cut-out, humble three-story with fire escape and stoop steps, small and fragile against the vast empty paper around it, a tiny red pushpin holding it down. RIGHT BACKGROUND, HUGE: a colossal Manhattan skyline of skyscrapers, black-and-white cut-out, towering financial towers rising to the top of the frame, dwarfing the small building like a giant beside a toy, slightly faded and distressed like an old newsprint photo, the towers overlapping the top-right corner. CENTER-RIGHT, MIDDLE DISTANCE: a small paper specimen label pinned by a red pushpin, blank, museum-exhibit style, a thin red thread looped around the pin trailing toward the small building. BEHIND the skyline, huge flat bold typography \"SMALL START\" in muted gold, the towers slightly occluding two letters, text occupying 30% of frame, condensed magazine-cover style. Layered paper collage with soft drop shadows, museum-quiet minimal composition, generous negative space, flat print, premium VOX-style documentary editorial collage, 16:9. No clutter, no unnecessary objects, no excessive icons, no visual noise, no random decorations, no fantasy elements, no sci-fi elements unless required, no anime, no cartoon style, no CGI look, no glossy 3D rendering, no photorealistic background, no oversaturated colors, no poor composition, no distorted anatomy, no blurry details, no watermark, no logos, maintain a clean premium VOX-style editorial collage with layered paper textures and documentary-quality composition."
        },
        {
          "id": "b1.2",
          "sync_sentence": "37年后，这家公司管理着超过10.5万亿美元的资产，相当于全球GDP的十分之一。",
          "semantic_family": "grow",
          "duration_seconds": 7.4,
          "start_seconds": 4.3,
          "end_seconds": 11.7,
          "visual_idea": "10.5 万亿大数字标题 + 增长曲线 + 全球 GDP 对比图章",
          "elements": [
            {
              "layer": "bg",
              "kind": "img",
              "data_class": "creative",
              "description": "financial newspaper front page with stock tables and market columns, aged paper",
              "box": [
                0,
                0,
                100,
                100
              ],
              "rot": 0,
              "z": 0,
              "family": "fade",
              "micro": "breathe"
            },
            {
              "layer": "hero",
              "kind": "img",
              "data_class": "real_data",
              "data_source": "BlackRock 2024 Q4 AUM report; World Bank GDP estimates",
              "description": "large numeral 10.5 TRILLION as editorial headline, growth curve beneath",
              "box": [
                18,
                10,
                50,
                45
              ],
              "rot": 0,
              "z": 10,
              "family": "drop",
              "micro": "breathe"
            },
            {
              "layer": "element",
              "kind": "img",
              "data_class": "real_data",
              "data_source": "World Bank GDP estimates",
              "description": "matplotlib bar chart comparing AUM vs global GDP, restyled as VOX paper chart",
              "box": [
                55,
                55,
                35,
                30
              ],
              "rot": 0,
              "z": 5,
              "family": "slide",
              "micro": "sway"
            },
            {
              "layer": "decor",
              "kind": "css",
              "data_class": "css",
              "description": "date stamp 2024, red ink",
              "text": "2024",
              "family": "pop",
              "micro": "pulse"
            }
          ],
          "core_idea": "巨大财富：37年膨胀到无法想象的规模",
          "visual_metaphor": "沙漏金字塔：时间让金钱膨胀成一座塔"
        },
        {
          "id": "b1.3",
          "sync_sentence": "它叫贝莱德。",
          "semantic_family": "slap",
          "duration_seconds": 4.1,
          "start_seconds": 11.7,
          "end_seconds": 15.8,
          "visual_idea": "BlackRock logo 印章砸下，全屏定格",
          "elements": [
            {
              "layer": "bg",
              "kind": "img",
              "data_class": "creative",
              "description": "institutional letterhead paper with faint company registry texture",
              "box": [
                0,
                0,
                100,
                100
              ],
              "rot": 0,
              "z": 0,
              "family": "fade",
              "micro": "breathe"
            },
            {
              "layer": "hero",
              "kind": "img",
              "data_class": "real_content",
              "data_source": "BlackRock official logo (user upload or web search)",
              "description": "BlackRock logo as black-and-white stamp, centered, slightly rotated",
              "box": [
                30,
                25,
                40,
                50
              ],
              "rot": -3,
              "z": 10,
              "family": "drop",
              "micro": "breathe"
            },
            {
              "layer": "decor",
              "kind": "css",
              "data_class": "css",
              "description": "ink stamp effect overlay, red ring underline",
              "text": "BLACKROCK",
              "family": "pop",
              "micro": "pulse"
            }
          ],
          "core_idea": "名字揭晓：这个帝国叫贝莱德",
          "visual_metaphor": "官方图章落下：像宣告一样盖章确认名字"
        }
      ]
    },
    {
      "id": "sc2",
      "type": "paper_collage",
      "description": "Quick Introduction：你的钱很可能在它账上，它不生产任何东西但最有影响力",
      "paragraph_label": "quick_intro",
      "locked_camera": true,
      "start_seconds": 15.8,
      "end_seconds": 34.6,
      "script_section_id": "s2",
      "shot_intent": "建立个人关联：把观众的钱包/养老金与贝莱德连接",
      "narrative_role": "establish_context",
      "beats": [
        {
          "id": "b2.1",
          "sync_sentence": "你可能从未听说过它，但你的养老金、你买的ETF、甚至你所在公司的股票，很可能都在它的账上。",
          "semantic_family": "pop",
          "duration_seconds": 10.6,
          "start_seconds": 15.8,
          "end_seconds": 26.4,
          "visual_idea": "钱包/养老金手册 hero + ETF 标签 + 箭头指向账本",
          "elements": [
            {
              "layer": "bg",
              "kind": "img",
              "data_class": "creative",
              "description": "ledger paper background with handwritten numbers",
              "box": [
                0,
                0,
                100,
                100
              ],
              "rot": 0,
              "z": 0,
              "family": "fade",
              "micro": "breathe"